{
    "businessTimestamp": null,
    "cdsId": "b45a52c7-0346-4ebd-801b-ab7b1610ac04",
    "comoDocumentType": "INTERNAL_PSK_FLAT_LIST",
    "comoDocumentVersion": "R24Q4V1_0",
    "documentId": "93573d27-6972-4a36-8d2d-7090d79b437e",
    "ownerCode": "10XDE-EON-NETZ-C",
    "ownerRole": "Network Engineer",
    "powerShiftKeyList": [
        {
            "areaCode": "10YDOM-1010A0213",
            "blockType": null,
            "energyGroupMrid": null,
            "resourceMrid": null,
            "resourceType": "hydroPump",
            "value": {
                "activePowerMax": null,
                "activePowerMin": null,
                "blockOrder": null,
                "participationFactor": null,
                "shiftDirection": null
            }
        }
    ],
    "timeHorizon": "monthAhead",
    "timeInterval": {
        "from": "2024-01-01T00:00:00",
        "to": "2024-01-01T06:00:00"
    },
    "version": 9
}