{
    "businessTimestamp": null,
    "cdsId": "ce3255af-4b1e-46f8-b09c-1bc9763b6cbd",
    "comoDocumentType": "INTERNAL_PSK_FLAT_LIST",
    "comoDocumentVersion": "R24Q4V1_0",
    "documentId": "54797d72-90e0-47c0-8fad-7fbc1965fe5a",
    "ownerCode": "10YDE-VE-------2",
    "ownerRole": "System Operator",
    "powerShiftKeyList": null,
    "timeHorizon": "monthAhead",
    "timeInterval": null,
    "version": 7
}