{
    "businessTimestamp": "2024-01-01T02:30:00",
    "timeInterval": {
        "from": "2024-01-01T02:00:00",
        "to": "2024-01-01T03:00:00"
    },
    "version": 1,
    "timeHorizon": "dayAhead",
    "ownerCode": "10XAT-APG------Z",
    "ownerRole": "Grid Manager",
    "cdsId": "8cfccce3-00d3-4565-b50b-eedfaa7b4534",
    "documentId": "c00e7996-9978-408e-911a-f9f33cd04838",
    "comoDocumentType": "INTERNAL_PSK_FLAT_LIST",
    "comoDocumentVersion": "R24Q4V1_0",
    "powerShiftKeyList": [
        {
            "areaCode": "10YAT-APG------L",
            "blockType": "generatorsAndConsumptionsP",
            "energyGroupMrid": "a5381ffb-26f8-4361-85dd-603bf733e72c",
            "resourceMrid": "550b17b2-280d-4a83-a8fb-04286225c12f",
            "resourceType": "hydroPump",
            "value": {
                "activePowerMax": 64.85,
                "activePowerMin": 54.88,
                "blockOrder": 1,
                "participationFactor": 95.97,
                "shiftDirection": "up"
            }
        }
    ]
}