{
    "businessTimestamp": "2024-01-01T08:30:00",
    "timeInterval": {
        "from": "2024-01-01T08:00:00",
        "to": "2024-01-01T09:00:00"
    },
    "version": 1,
    "timeHorizon": "dayAhead",
    "ownerCode": "10XHR-HEP-OPS--A",
    "ownerRole": "Grid Manager",
    "cdsId": "b009f515-1b50-4b58-adf1-a560721145ab",
    "documentId": "a56405a4-d089-4fef-95cf-e99cb870266b",
    "comoDocumentType": "INTERNAL_PSK_FLAT_LIST",
    "comoDocumentVersion": "R24Q4V1_0",
    "powerShiftKeyList": [
        {
            "areaCode": "10YHR-HEP------M",
            "blockType": "generatorsPmin",
            "energyGroupMrid": "54709288-8905-4334-b729-9e133b617bf4",
            "resourceMrid": "432605d1-4486-4628-8f93-5cb9f5b88a2a",
            "resourceType": "energyConsumer",
            "value": {
                "activePowerMax": 159.61,
                "activePowerMin": 99.76,
                "blockOrder": 1,
                "participationFactor": 43.4,
                "shiftDirection": "up"
            }
        }
    ]
}